Gene,Disease,disease_name
prss1,ORPHA:676,Orphanet: Hereditary chronic pancreatitis
esrrb,ORPHA:90636,Orphanet: Rare autosomal recessive non-syndromic sensorineural deafness type DFNB
csnk2b,ORPHA:178469,Orphanet: Autosomal dominant non-syndromic intellectual disability
csnk2a1,ORPHA:528084,Orphanet: Non-specific syndromic intellectual disability
gabrb2,ORPHA:442835,Orphanet: Non-specific early-onset epileptic encephalopathy
gabrg2,ORPHA:33069,Orphanet: Dravet syndrome
cd81,ORPHA:1572,Orphanet: Common variable immunodeficiency
akt2,ORPHA:79085,Orphanet: AKT2-related familial partial lipodystrophy
akt3,ORPHA:99802,Orphanet: Hemimegalencephaly
akt1,ORPHA:2495,Orphanet: Meningioma
avpr2,ORPHA:93606,Orphanet: Nephrogenic syndrome of inappropriate antidiuresis
alb,ORPHA:86816,Orphanet: Congenital analbuminemia
epha2,ORPHA:98993,Orphanet: Early-onset posterior polar cataract
ephb2,ORPHA:1331,Orphanet: Familial prostate cancer
epha4,ORPHA:803,Orphanet: Amyotrophic lateral sclerosis
ephb4,ORPHA:568065,Orphanet: EPHB4-related lymphatic-related hydrops fetalis
nectin4,ORPHA:247820,Orphanet: Ectodermal dysplasia-pili torti-cutaneous syndactyly syndrome
thrb,ORPHA:566243,Orphanet: Resistance to thyroid hormone due to a mutation in thyroid hormone receptor beta
flt4,ORPHA:464293,Orphanet: NON RARE IN EUROPE: Infantile capillary hemangioma
vhl,ORPHA:29072,Orphanet: Hereditary pheochromocytoma-paraganglioma
dbh,ORPHA:230,Orphanet: Dopamine beta-hydroxylase deficiency
ctsc,ORPHA:678,Orphanet: Papillon-Lefèvre syndrome
bcl2,ORPHA:545,Orphanet: Follicular lymphoma
f9,ORPHA:169796,Orphanet: Moderate hemophilia B
ctsh,ORPHA:2073,Orphanet: Narcolepsy type 1
ctsk,ORPHA:763,Orphanet: Pycnodysostosis
stat1,ORPHA:319595,Orphanet: Mendelian susceptibility to mycobacterial diseases due to partial STAT1 deficiency
tpp2,ORPHA:444463,Orphanet: Autoimmune hemolytic anemia-autoimmune thrombocytopenia-primary immunodeficiency syndrome due to TPP2 deficiency
ddr2,ORPHA:93358,Orphanet: Spondyloepimetaphyseal dysplasia-short limb-abnormal calcification syndrome
tkt,ORPHA:488618,Orphanet: Transketolase deficiency
grik2,ORPHA:88616,Orphanet: Autosomal recessive non-syndromic intellectual disability
plcb3,ORPHA:589435,Orphanet: Spondylometaphyseal dysplasia-corneal dystrophy syndrome
mtor,ORPHA:457485,Orphanet: Macrocephaly-intellectual disability-neurodevelopmental disorder-small thorax syndrome
scn11a,ORPHA:46348,Orphanet: Paroxysmal extreme pain disorder
ryr1,ORPHA:99741,Orphanet: King-Denborough syndrome
bcor,ORPHA:457246,Orphanet: Clear cell sarcoma of kidney
tgfb1,ORPHA:565788,Orphanet: Infantile inflammatory bowel disease with neurological involvement
slc27a4,ORPHA:88621,Orphanet: Ichthyosis-prematurity syndrome
grin1,ORPHA:1934,Orphanet: Early infantile epileptic encephalopathy
grin2a,ORPHA:289266,Orphanet: Early-onset epileptic encephalopathy and intellectual disability due to GRIN2A mutation
grin2b,ORPHA:3451,Orphanet: Infantile spasms syndrome
bmp6,ORPHA:465508,Orphanet: Symptomatic form of HFE-related hemochromatosis
notch1,ORPHA:402075,Orphanet: Familial bicuspid aortic valve
apol1,ORPHA:656,Orphanet: Genetic steroid-resistant nephrotic syndrome
neu1,ORPHA:93400,Orphanet: Congenital sialidosis type 2
prkaca,ORPHA:401920,Orphanet: Fibrolamellar hepatocellular carcinoma
prkcg,ORPHA:98763,Orphanet: Spinocerebellar ataxia type 14
pkd1,ORPHA:88924,Orphanet: Autosomal dominant polycystic kidney disease type 1 with tuberous sclerosis
prkd1,ORPHA:500481,Orphanet: Squamous cell carcinoma of salivary glands
pik3r1,ORPHA:33110,Orphanet: Autosomal agammaglobulinemia
pik3ca,ORPHA:221061,Orphanet: Familial cerebral cavernous malformation
pik3r2,ORPHA:83473,Orphanet: Megalencephaly-polymicrogyria-postaxial polydactyly-hydrocephalus syndrome
pik3cd,ORPHA:221139,Orphanet: Combined immunodeficiency with facio-oculo-skeletal anomalies
pik3r5,ORPHA:64753,Orphanet: Spinocerebellar ataxia with axonal neuropathy type 2
fkbp14,ORPHA:300179,Orphanet: Kyphoscoliotic Ehlers-Danlos syndrome due to FKBP22 deficiency
epo,ORPHA:247511,Orphanet: Autosomal dominant secondary polycythemia
tgm1,ORPHA:100976,Orphanet: Bathing suit ichthyosis
rab7a,ORPHA:99936,Orphanet: Autosomal dominant Charcot-Marie-Tooth disease type 2B
cdkn1a,ORPHA:652,Orphanet: Multiple endocrine neoplasia type 1
alk,ORPHA:300895,Orphanet: ALK-positive anaplastic large cell lymphoma
atp6v1b2,ORPHA:3473,Orphanet: Zimmermann-Laband syndrome
ampd1,ORPHA:45,Orphanet: Adenosine monophosphate deaminase deficiency
mogs,ORPHA:79330,Orphanet: MOGS-CDG
msh2,ORPHA:252202,Orphanet: Constitutional mismatch repair deficiency syndrome
gnao1,ORPHA:592564,Orphanet: GNAO1-related developmental delay-seizures-movement disorder spectrum
chrna7,ORPHA:199318,Orphanet: 15q13.3 microdeletion syndrome
mst1,ORPHA:171,Orphanet: Primary sclerosing cholangitis
stk4,ORPHA:314689,Orphanet: Combined immunodeficiency due to STK4 deficiency
il17ra,ORPHA:1334,Orphanet: Chronic mucocutaneous candidiasis
egfr,ORPHA:294023,Orphanet: Neonatal inflammatory skin and bowel disease
mertk,ORPHA:791,Orphanet: Retinitis pigmentosa
tpm3,ORPHA:171881,Orphanet: Cap myopathy
lpar6,ORPHA:55654,Orphanet: Hypotrichosis simplex
mapt,ORPHA:240103,Orphanet: Progressive supranuclear palsy-corticobasal syndrome
keap1,ORPHA:276399,Orphanet: Familial multinodular goiter
cul3,ORPHA:300530,Orphanet: Pseudohypoaldosteronism type 2E
itpr1,ORPHA:1065,Orphanet: Aniridia-cerebellar ataxia-intellectual disability syndrome
pde4d,ORPHA:950,Orphanet: Acrodysostosis
spr,ORPHA:70594,Orphanet: Dopa-responsive dystonia due to sepiapterin reductase deficiency
etv6,ORPHA:71290,Orphanet: Familial platelet disorder with associated myeloid malignancy
pparg,ORPHA:528,Orphanet: Congenital generalized lipodystrophy
nsd2,ORPHA:280,Orphanet: Wolf-Hirschhorn syndrome
hdac6,ORPHA:163966,"Orphanet: X-linked dominant chondrodysplasia, Chassaing-Lacombe type"
gpr68,ORPHA:100033,Orphanet: Hypomaturation amelogenesis imperfecta
p2ry12,ORPHA:36355,Orphanet: Bleeding disorder due to P2Y12 defect
abhd12,ORPHA:171848,Orphanet: Polyneuropathy-hearing loss-ataxia-retinitis pigmentosa-cataract syndrome
cdk6,ORPHA:2512,Orphanet: Autosomal recessive primary microcephaly
gdf2,ORPHA:774,Orphanet: Hereditary hemorrhagic telangiectasia
ddc,ORPHA:35708,Orphanet: Aromatic L-amino acid decarboxylase deficiency
gclc,ORPHA:586,Orphanet: Cystic fibrosis
cdk13,ORPHA:646278,Orphanet: CDK13-related developmental delay-intellectual disability-facial dysmorphism-congenital heart defects syndrome
ccnk,ORPHA:600668,Orphanet: CCNK-related neurodevelopmental disorder-severe intellectual disability-facial dysmorphism syndrome
ampd2,ORPHA:369920,Orphanet: Pontocerebellar hypoplasia type 9
flt3,ORPHA:102724,Orphanet: Acute myeloid leukemia with t(8;21)(q22;q22) translocation
mpi,ORPHA:79319,Orphanet: MPI-CDG
ntrk1,ORPHA:642,Orphanet: Hereditary sensory and autonomic neuropathy type 4
mcoln1,ORPHA:578,Orphanet: Mucolipidosis type IV
mapk1,ORPHA:261330,Orphanet: Distal 22q11.2 microdeletion syndrome
myc,ORPHA:543,Orphanet: Burkitt lymphoma
cog6,ORPHA:363523,Orphanet: Hypohidrosis-enamel hypoplasia-palmoplantar keratoderma-intellectual disability syndrome
yars1,ORPHA:100045,Orphanet: Autosomal dominant intermediate Charcot-Marie-Tooth disease type C
pde6c,ORPHA:49382,Orphanet: Achromatopsia
mllt3,ORPHA:402017,Orphanet: Acute myeloid leukemia with t(9;11)(p22;q23)
ar,ORPHA:481,Orphanet: Kennedy disease
xpo1,ORPHA:98838,Orphanet: Primary mediastinal large B-cell lymphoma
kcnq4,ORPHA:90635,Orphanet: Rare autosomal dominant non-syndromic sensorineural deafness type DFNA
pnmt,ORPHA:243761,Orphanet: NON RARE IN EUROPE: Essential hypertension
sucla2,ORPHA:1933,"Orphanet: Mitochondrial DNA depletion syndrome, encephalomyopathic form with methylmalonic aciduria"
il12b,ORPHA:319558,Orphanet: Mendelian susceptibility to mycobacterial diseases due to complete IL12B deficiency
kdm1a,ORPHA:477993,Orphanet: Palatal anomalies-widely spaced teeth-facial dysmorphism-developmental delay syndrome
csnk1d,ORPHA:164736,Orphanet: Familial advanced sleep-phase syndrome
esr2,ORPHA:99361,Orphanet: Familial medullary thyroid carcinoma
cyp21a2,ORPHA:95698,Orphanet: NON RARE IN EUROPE: Non-classic congenital adrenal hyperplasia due to 21-hydroxylase deficiency
il11ra,ORPHA:284149,Orphanet: Craniosynostosis-dental anomalies
serping1,ORPHA:100051,Orphanet: Hereditary angioedema type 2
trpm4,ORPHA:871,Orphanet: Familial progressive cardiac conduction defect
gata2,ORPHA:228423,Orphanet: Monocytopenia with susceptibility to infections
pla2g6,ORPHA:35069,Orphanet: Infantile neuroaxonal dystrophy
lpl,ORPHA:309015,Orphanet: Familial lipoprotein lipase deficiency
cth,ORPHA:212,Orphanet: Cystathioninuria
ptpn2,ORPHA:771,Orphanet: NON RARE IN EUROPE: Ulcerative colitis
notch3,ORPHA:2591,Orphanet: Infantile myofibromatosis
angpt1,ORPHA:599418,Orphanet: Hereditary angioedema with normal C1Inh not related to F12 or PLG variant
il2rg,ORPHA:39041,Orphanet: Omenn syndrome
il2rb,ORPHA:85408,Orphanet: Rheumatoid factor-negative polyarticular juvenile idiopathic arthritis
iars1,ORPHA:541423,Orphanet: Growth delay-intellectual disability-hepatopathy syndrome
apc,ORPHA:247806,Orphanet: APC-related attenuated familial adenomatous polyposis
tcf4,ORPHA:98974,Orphanet: Fuchs endothelial corneal dystrophy
pi4ka,ORPHA:436252,Orphanet: Combined immunodeficiency-enteropathy spectrum
gabra3,ORPHA:79102,Orphanet: Thyrotoxic periodic paralysis
abl1,ORPHA:521,Orphanet: Chronic myeloid leukemia
tet2,ORPHA:729,Orphanet: Polycythemia vera
ldha,ORPHA:284426,Orphanet: Glycogen storage disease due to lactate dehydrogenase M-subunit deficiency
gabrd,ORPHA:1606,Orphanet: 1p36 deletion syndrome
dgat1,ORPHA:329242,Orphanet: Congenital chronic diarrhea with protein-losing enteropathy
eif2ak3,ORPHA:1667,Orphanet: Wolcott-Rallison syndrome
tnfrsf4,ORPHA:431149,Orphanet: Combined immunodeficiency due to OX40 deficiency
ak1,ORPHA:86817,Orphanet: Hemolytic anemia due to adenylate kinase deficiency
gabrb3,ORPHA:64280,Orphanet: Childhood absence epilepsy
wnk4,ORPHA:88939,Orphanet: Pseudohypoaldosteronism type 2B
phip,ORPHA:589905,Orphanet: PHIP-related behavioral problems-intellectual disability-obesity-dysmorphic features syndrome
wdr11,ORPHA:432,Orphanet: Normosmic congenital hypogonadotropic hypogonadism
ikzf3,ORPHA:67038,Orphanet: B-cell chronic lymphocytic leukemia
sf3b1,ORPHA:39044,Orphanet: Uveal melanoma
prnp,ORPHA:466,Orphanet: Fatal familial insomnia
dkk1,ORPHA:85193,Orphanet: Idiopathic juvenile osteoporosis
jak1,ORPHA:574957,Orphanet: Autosomal recessive mendelian susceptibility to mycobacterial diseases due to partial JAK1 deficiency
mmp19,ORPHA:464760,Orphanet: Familial cavitary optic disc anomaly
c5,ORPHA:169150,Orphanet: Immunodeficiency due to a late component of complement deficiency
trpc3,ORPHA:458798,Orphanet: Spinocerebellar ataxia type 41
chm,ORPHA:180,Orphanet: Choroideremia
rac1,ORPHA:500159,Orphanet: Microcephaly-corpus callosum and cerebellar vermis hypoplasia-facial dysmorphism-intellectual disability syndrom
chst14,ORPHA:2953,Orphanet: Musculocontractural Ehlers-Danlos syndrome
kcnt1,ORPHA:293181,Orphanet: Malignant migrating focal seizures of infancy
park7,ORPHA:90020,Orphanet: Parkinson-dementia complex of Guam
treh,ORPHA:103909,Orphanet: Trehalase deficiency
cdk4,ORPHA:618,Orphanet: Familial melanoma
uqcrb,ORPHA:1460,Orphanet: Isolated complex III deficiency
zap70,ORPHA:911,Orphanet: Combined immunodeficiency due to ZAP70 deficiency
sox9,ORPHA:2138,"Orphanet: 46,XX ovotesticular difference of sex development"
nbn,ORPHA:647,Orphanet: Nijmegen breakage syndrome
lin28b,ORPHA:635,Orphanet: Neuroblastoma
tpm4,ORPHA:140957,Orphanet: Autosomal dominant macrothrombocytopenia
epor,ORPHA:90042,Orphanet: Primary familial polycythemia
csf2rb,ORPHA:264675,Orphanet: Hereditary pulmonary alveolar proteinosis
tfrc,ORPHA:476113,Orphanet: Combined immunodeficiency due to TFRC deficiency
gpnmb,ORPHA:319635,Orphanet: Amyloidosis cutis dyschromia
ctnnb1,ORPHA:85142,Orphanet: NON RARE IN EUROPE: Aldosterone-producing adenoma
dpagt1,ORPHA:86309,Orphanet: DPAGT1-CDG
ikbkg,ORPHA:319612,Orphanet: X-linked mendelian susceptibility to mycobacterial diseases due to IKBKG deficiency
tgfb2,ORPHA:91387,Orphanet: Familial thoracic aortic aneurysm and aortic dissection
sc5d,ORPHA:46059,Orphanet: Lathosterolosis
limk1,ORPHA:904,Orphanet: Williams syndrome
cenpe,ORPHA:808,Orphanet: Seckel syndrome
atp6v1b1,ORPHA:402041,Orphanet: Autosomal recessive distal renal tubular acidosis
sts,ORPHA:461,Orphanet: Recessive X-linked ichthyosis
pde3a,ORPHA:1276,Orphanet: Brachydactyly-arterial hypertension syndrome
ntrk2,ORPHA:251615,Orphanet: Pilomyxoid astrocytoma
l1cam,ORPHA:2182,Orphanet: Hydrocephalus with stenosis of the aqueduct of Sylvius
serpinc1,ORPHA:82,Orphanet: Hereditary thrombophilia due to congenital antithrombin deficiency
aifm1,ORPHA:83629,Orphanet: Leukoencephalopathy-spondyloepimetaphyseal dysplasia syndrome
apoc3,ORPHA:426,Orphanet: NON RARE IN EUROPE: Familial hypobetalipoproteinemia
myh2,ORPHA:363677,Orphanet: Childhood-onset autosomal recessive myopathy with external ophthalmoplegia
slc12a2,ORPHA:633021,Orphanet: SLC12A2-related autosomal recessive neonatal-developmental delay-intellectual disability-feeding difficulty-sensorineural deafness syndrome
gata4,ORPHA:576232,Orphanet: Partial atrioventricular septal defect with ventricular hypoplasia
pcsk9,ORPHA:406,Orphanet: NON RARE IN EUROPE: Heterozygous familial hypercholesterolemia
hnrnpa2b1,ORPHA:52430,Orphanet: Inclusion body myopathy with Paget disease of bone and frontotemporal dementia
slc27a5,ORPHA:276066,Orphanet: Bile acid CoA ligase deficiency and defective amidation
b4galt1,ORPHA:79332,Orphanet: B4GALT1-CDG
ldhb,ORPHA:284435,Orphanet: Glycogen storage disease due to lactate dehydrogenase H-subunit deficiency
aldh18a1,ORPHA:447760,Orphanet: Autosomal recessive spastic paraplegia type 9B
nr4a2,ORPHA:98808,Orphanet: Autosomal dominant dopa-responsive dystonia
aqp2,ORPHA:223,Orphanet: Arginine vasopressin resistance
dpp9,ORPHA:2032,Orphanet: Idiopathic pulmonary fibrosis
ghsr,ORPHA:314811,Orphanet: Short stature due to GHSR deficiency
gnpat,ORPHA:309796,Orphanet: Rhizomelic chondrodysplasia punctata type 2
il1rn,ORPHA:210115,Orphanet: Sterile multifocal osteomyelitis with periostitis and pustulosis
rbck1,ORPHA:397937,Orphanet: Polyglucosan body myopathy type 1
rnf31,ORPHA:329173,Orphanet: Autoinflammatory syndrome with pyogenic bacterial infection and amylopectinosis
fcgr3a,ORPHA:437552,Orphanet: Autosomal recessive primary immunodeficiency with defective spontaneous natural killer cell cytotoxicity
aurkc,ORPHA:137893,Orphanet: Male infertility due to large-headed multiflagellar polyploid spermatozoa
grm6,ORPHA:215,Orphanet: Congenital stationary night blindness
pde8b,ORPHA:228169,Orphanet: Autosomal dominant striatal neurodegeneration
gnaq,ORPHA:624,Orphanet: Familial multiple nevi flammei
gna11,ORPHA:428,Orphanet: Autosomal dominant hypocalcemia
trpv4,ORPHA:85169,Orphanet: Familial digital arthropathy-brachydactyly
phkg2,ORPHA:264580,Orphanet: Glycogen storage disease due to liver phosphorylase kinase deficiency
pdcd1,ORPHA:536,Orphanet: Systemic lupus erythematosus
nthl1,ORPHA:454840,Orphanet: NTHL1-related attenuated familial adenomatous polyposis
inhba,ORPHA:213504,Orphanet: Adenocarcinoma of ovary
pah,ORPHA:2209,Orphanet: Maternal phenylketonuria
mid1,ORPHA:2745,Orphanet: Opitz GBBB syndrome
chrnb2,ORPHA:98784,Orphanet: Autosomal dominant nocturnal frontal lobe epilepsy
kif23,ORPHA:98870,Orphanet: Congenital dyserythropoietic anemia type III
stat4,ORPHA:93552,Orphanet: Pediatric systemic lupus erythematosus
tuba1a,ORPHA:467166,Orphanet: Tubulinopathy-associated dysgyria
txnrd2,ORPHA:154,Orphanet: Familial isolated dilated cardiomyopathy
nfe2l2,ORPHA:619979,Orphanet: Developmental delay-immunodeficiency-leukoencephalopathy-hypohomocysteinemia syndrome
trpv6,ORPHA:417,Orphanet: Neonatal severe primary hyperparathyroidism
sumo1,ORPHA:99798,Orphanet: Oligodontia
acat1,ORPHA:134,Orphanet: Beta-ketothiolase deficiency
cbfb,ORPHA:98829,Orphanet: Acute myeloid leukemia with abnormal bone marrow eosinophils inv(16)(p13q22) or t(16;16)(p13;q22)
tnfsf11,ORPHA:667,Orphanet: Autosomal recessive malignant osteopetrosis
tdp2,ORPHA:404493,Orphanet: Autosomal recessive cerebellar ataxia-epilepsy-intellectual disability syndrome due to TUD deficiency
sos1,ORPHA:648,Orphanet: Noonan syndrome
shh,ORPHA:485275,Orphanet: Acquired schizencephaly
pola1,ORPHA:163976,"Orphanet: X-linked intellectual disability, Van Esch type"
pold1,ORPHA:447877,Orphanet: Polymerase proofreading-related adenomatous polyposis
cyp27a1,ORPHA:909,Orphanet: Cerebrotendinous xanthomatosis
ins,ORPHA:552,Orphanet: MODY
hspd1,ORPHA:100994,Orphanet: Autosomal dominant spastic paraplegia type 13
mt-nd6,ORPHA:99718,Orphanet: Leber plus disease
ndufs8,ORPHA:2609,Orphanet: Isolated complex I deficiency
mt-nd4l,ORPHA:104,Orphanet: Leber hereditary optic neuropathy
mt-nd1,ORPHA:255210,Orphanet: Mitochondrial DNA-associated Leigh syndrome
ndufa2,ORPHA:85136,Orphanet: Cystic leukoencephalopathy without megalencephaly
ndufa13,ORPHA:146,Orphanet: Differentiated thyroid carcinoma
tars1,ORPHA:33364,Orphanet: Trichothiodystrophy
c1s,ORPHA:169147,Orphanet: Immunodeficiency due to a classical component pathway complement deficiency
rb1,ORPHA:357027,Orphanet: Hereditary retinoblastoma
tmprss15,ORPHA:168601,Orphanet: Congenital enteropathy due to enteropeptidase deficiency
pde6d,ORPHA:475,Orphanet: Joubert syndrome
ednrb,ORPHA:895,Orphanet: Waardenburg syndrome type 2
stat2,ORPHA:431166,Orphanet: Primary immunodeficiency with post-measles-mumps-rubella vaccine viral infection
hars1,ORPHA:231183,Orphanet: Usher syndrome type 3
tyk2,ORPHA:331226,Orphanet: Susceptibility to infection due to TYK2 deficiency
snca,ORPHA:1648,Orphanet: NON RARE IN EUROPE: Dementia with Lewy body
pak3,ORPHA:777,Orphanet: X-linked non-syndromic intellectual disability
pak2,ORPHA:1571,Orphanet: Knobloch syndrome
abhd5,ORPHA:98907,Orphanet: Neutral lipid storage disease with ichthyosis
hk1,ORPHA:90031,Orphanet: Non-spherocytic hemolytic anemia due to hexokinase deficiency
nt5e,ORPHA:289601,Orphanet: Hereditary arterial and articular multiple calcification syndrome
mdm2,ORPHA:524,Orphanet: Li-Fraumeni syndrome
plcg2,ORPHA:324530,Orphanet: Autoinflammation-PLCG2-associated antibody deficiency-immune dysregulation
f7,ORPHA:327,Orphanet: Congenital factor VII deficiency
malt1,ORPHA:397964,Orphanet: Combined immunodeficiency due to MALT1 deficiency
ppp1cb,ORPHA:2701,Orphanet: Noonan syndrome-like disorder with loose anagen hair
polh,ORPHA:90342,Orphanet: Xeroderma pigmentosum variant
pot1,ORPHA:251630,Orphanet: Anaplastic oligodendroglioma
xrcc4,ORPHA:436182,Orphanet: Microcephalic primordial dwarfism-insulin resistance syndrome
p4hb,ORPHA:216796,Orphanet: Osteogenesis imperfecta type 1
sox18,ORPHA:69735,Orphanet: Hypotrichosis-lymphedema-telangiectasia-renal defect syndrome
gpc3,ORPHA:654,Orphanet: Nephroblastoma
map2k1,ORPHA:1340,Orphanet: Cardiofaciocutaneous syndrome
itk,ORPHA:538963,Orphanet: Combined immunodeficiency due to ITK deficiency
btk,ORPHA:632,Orphanet: Short stature due to isolated growth hormone deficiency with X-linked hypogammaglobulinemia
rela,ORPHA:251636,Orphanet: Ependymoma
ppm1d,ORPHA:653767,Orphanet: Jansen-de Vries syndrome
tpi1,ORPHA:868,Orphanet: Triose phosphate-isomerase deficiency
slc34a2,ORPHA:60025,Orphanet: Pulmonary alveolar microlithiasis
ikzf1,ORPHA:317473,Orphanet: Pancytopenia due to IKZF1 mutations
hamp,ORPHA:79230,Orphanet: HJV or HAMP-related hemochromatosis
ptprc,ORPHA:169157,Orphanet: T-B+ severe combined immunodeficiency due to CD45 deficiency
kcnq3,ORPHA:1949,Orphanet: Benign familial neonatal epilepsy
ccnd1,ORPHA:29073,Orphanet: Multiple myeloma
eef2,ORPHA:101112,Orphanet: Spinocerebellar ataxia type 26
ctrc,ORPHA:103918,Orphanet: Tropical pancreatitis
dvl3,ORPHA:3107,Orphanet: Autosomal dominant Robinow syndrome
drd2,ORPHA:36899,Orphanet: Myoclonus-dystonia syndrome
wnt3,ORPHA:3301,Orphanet: Tetraamelia-multiple malformations syndrome
erg,ORPHA:370334,Orphanet: Extraskeletal Ewing sarcoma
tbx5,ORPHA:101016,Orphanet: Romano-Ward syndrome
vrk1,ORPHA:2254,Orphanet: Pontocerebellar hypoplasia type 1
hlf,ORPHA:641375,Orphanet: B-lymphoblastic leukemia/lymphoma with t(17;19)
hpgd,ORPHA:217059,Orphanet: Isolated congenital digital clubbing
pygm,ORPHA:368,Orphanet: Glycogen storage disease due to muscle glycogen phosphorylase deficiency
lrp1,ORPHA:79100,Orphanet: Atrophoderma vermiculata
f13b,ORPHA:331,Orphanet: Congenital factor XIII deficiency
slc17a5,ORPHA:309324,"Orphanet: Free sialic acid storage disease, infantile form"
ezh2,ORPHA:3447,Orphanet: Weaver syndrome
pip5k1c,ORPHA:137783,Orphanet: Lethal congenital contracture syndrome type 3
htra1,ORPHA:252128,Orphanet: Malignant peripheral nerve sheath tumor with perineurial differentiation
lonp1,ORPHA:79243,Orphanet: Pyruvate dehydrogenase E1-alpha deficiency
gba1,ORPHA:2072,Orphanet: Gaucher disease-ophthalmoplegia-cardiovascular calcification syndrome
gba2,ORPHA:320391,Orphanet: Autosomal recessive spastic paraplegia type 46
slc40a1,ORPHA:648562,Orphanet: Ferroportin disease
kars1,ORPHA:254334,Orphanet: Autosomal recessive intermediate Charcot-Marie-Tooth disease type B
sqstm1,ORPHA:603,"Orphanet: Distal myopathy, Welander type"
katnb1,ORPHA:89844,"Orphanet: Lissencephaly syndrome, Norman-Roberts type"
fgf14,ORPHA:98764,Orphanet: Spinocerebellar ataxia type 27
fgfr3,ORPHA:85165,Orphanet: Severe achondroplasia-developmental delay-acanthosis nigricans syndrome
axin1,ORPHA:210159,Orphanet: Adult hepatocellular carcinoma
gucy1a1,ORPHA:401945,Orphanet: Moyamoya disease with early-onset achalasia
smn1,ORPHA:83330,Orphanet: Proximal spinal muscular atrophy type 1
tab2,ORPHA:228410,Orphanet: Cardiac anomalies-short stature-joint hypermobility-facial dysmorphism syndrome
pts,ORPHA:13,Orphanet: 6-pyruvoyl-tetrahydropterin synthase deficiency
calcrl,ORPHA:363999,Orphanet: Non-immune hydrops fetalis
g6pc1,ORPHA:79258,Orphanet: Glycogen storage disease due to glucose-6-phosphatase deficiency type Ia
ca5a,ORPHA:401948,Orphanet: Hyperammonemic encephalopathy due to carbonic anhydrase VA deficiency
xdh,ORPHA:93601,Orphanet: Xanthinuria type I
ror2,ORPHA:1507,Orphanet: Autosomal recessive Robinow syndrome
mt-co1,ORPHA:550,Orphanet: MELAS
hsd3b2,ORPHA:90791,Orphanet: Congenital adrenal hyperplasia due to 3-beta-hydroxysteroid dehydrogenase deficiency
hexa,ORPHA:309185,"Orphanet: Tay-Sachs disease, juvenile form"
kcnj3,ORPHA:334,Orphanet: Familial atrial fibrillation
dnmbp,ORPHA:98994,Orphanet: Total early-onset cataract
cybb,ORPHA:319623,Orphanet: X-linked mendelian susceptibility to mycobacterial diseases due to CYBB deficiency
ppp1r15b,ORPHA:391408,Orphanet: Primary microcephaly-mild intellectual disability-young-onset diabetes syndrome
hdac4,ORPHA:1001,Orphanet: 2q37 microdeletion syndrome
ptpn3,ORPHA:70567,Orphanet: Cholangiocarcinoma
tbk1,ORPHA:1930,Orphanet: Herpes simplex virus encephalitis
comt,ORPHA:567,Orphanet: 22q11.2 deletion syndrome
pde2a,ORPHA:31709,Orphanet: Infantile convulsions and choreoathetosis
catsper1,ORPHA:276234,Orphanet: Non-syndromic male infertility due to sperm motility disorder
rpn1,ORPHA:402020,Orphanet: Acute myeloid leukemia with inv(3)(q21q26.2) or t(3;3)(q21;q26.2)
slc25a20,ORPHA:159,Orphanet: Carnitine-acylcarnitine translocase deficiency
odc1,ORPHA:544488,Orphanet: Global developmental delay-alopecia-macrocephaly-facial dysmorphism-structural brain anomalies syndrome
rbp4,ORPHA:352718,Orphanet: Progressive retinal dystrophy due to retinol transport defect
erbb3,ORPHA:137776,Orphanet: Lethal congenital contracture syndrome type 2
creb1,ORPHA:97338,Orphanet: Melanoma of soft tissue
kif14,ORPHA:439897,Orphanet: Lethal fetal cerebrorenogenitourinary agenesis/hypoplasia syndrome
kcnj11,ORPHA:79134,Orphanet: DEND syndrome
abcc9,ORPHA:130,Orphanet: Brugada syndrome
coq7,ORPHA:319678,Orphanet: Encephalopathy-hypertrophic cardiomyopathy-renal tubular disease syndrome
ddit3,ORPHA:99967,Orphanet: Myxoid/round cell liposarcoma
atxn3,ORPHA:276241,Orphanet: Machado-Joseph disease type 2
ctsa,ORPHA:575553,Orphanet: Cathepsin A-related arteriopathy-strokes-leukoencephalopathy
scn5a,ORPHA:1344,Orphanet: Atrial standstill
stat5b,ORPHA:520,Orphanet: Acute promyelocytic leukemia
hprt1,ORPHA:79233,Orphanet: Hypoxanthine guanine phosphoribosyltransferase partial deficiency
pmm2,ORPHA:79318,Orphanet: PMM2-CDG
xpnpep2,ORPHA:100057,Orphanet: Renin-angiotensin-aldosterone system-blocker-induced angioedema
erap1,ORPHA:117,Orphanet: Behçet disease
xpnpep3,ORPHA:93589,Orphanet: Late-onset nephronophthisis
krt85,ORPHA:69084,Orphanet: Pure hair and nail ectodermal dysplasia
gria3,ORPHA:364028,Orphanet: X-linked intellectual disability due to GRIA3 mutations
gfer,ORPHA:330054,Orphanet: Congenital cataract-progressive muscular hypotonia-hearing loss-developmental delay syndrome
pgk1,ORPHA:713,Orphanet: Glycogen storage disease due to phosphoglycerate kinase 1 deficiency
polg,ORPHA:254886,Orphanet: Autosomal recessive progressive external ophthalmoplegia
fgfr2,ORPHA:596008,Orphanet: Antley-Bixler syndrome without genital anomaly or disorder of steroidogenesis
tp53,ORPHA:99756,Orphanet: Alveolar rhabdomyosarcoma
sall4,ORPHA:2307,Orphanet: IVIC syndrome
hdac8,ORPHA:3459,Orphanet: Wilson-Turner syndrome
rorc,ORPHA:477857,Orphanet: Autosomal recessive mendelian susceptibility to mycobacterial diseases due to complete RORgamma receptor deficiency
